{
  "$schema": "http://json-schema.org/draft-07/schema#",
  "type": "object",
  "properties": {
    "module": {
      "type": "string",
      "description": "The name of the current module"
    },
    "partyMembers": {
      "type": "array",
      "items": {
        "type": "string"
      },
      "description": "An array of strings representing the names of the player characters"
    },
    "partyNPCs": {
      "type": "array",
      "items": {
        "type": "object",
        "properties": {
          "name": {
            "type": "string",
            "description": "The name of the NPC"
          },
          "role": {
            "type": "string",
            "description": "The role or function of the NPC in the party"
          },
          "occupantId": {
            "type": "string",
            "pattern": "^occ:[^/]+/[^/]+/[^/]+$",
            "description": "The occupant id of the companion's person in the rules engine's live_state (absent on a companion saved before ids)"
          }
        },
        "required": ["name", "role"]
      },
      "description": "An array of NPCs accompanying the party"
    },
    "worldConditions": {
      "type": "object",
      "properties": {
        "year": {
          "type": "integer",
          "description": "The current year in the game world"
        },
        "month": {
          "type": "string",
          "enum": [
            "Firstmonth", "Coldmonth", "Thawmonth", "Springmonth",
            "Bloommonth", "Sunmonth", "Heatmonth", "Harvestmonth", 
            "Autumnmonth", "Fademonth", "Frostmonth", "Yearend"
          ],
          "description": "Current month using generic fantasy calendar (12 months, 28 days each)"
        },
        "day": {
          "type": "integer",
          "minimum": 1,
          "maximum": 28,
          "description": "Day of month in standardized 28-day calendar"
        },
        "time": {
          "type": "string",
          "description": "The current time of day in the game world"
        },
        "weather": {
          "type": "string",
          "description": "The current weather conditions"
        },
        "season": {
          "type": "string",
          "description": "The current season in the game world"
        },
        "dayNightCycle": {
          "type": "string",
          "description": "Whether it's currently day or night"
        },
        "moonPhase": {
          "type": "string",
          "description": "The current phase of the moon, if relevant"
        },
        "currentLocation": {
          "type": "string",
          "description": "The name of the party's current location"
        },
        "currentArea": {
          "type": "string",
          "description": "The name of the broader area or region the party is currently in"
        },
        "currentAreaId": {
          "type": "string",
          "description": "The unique identifier for the current area"
        },
        "majorEventsUnderway": {
          "type": "array",
          "items": {
            "type": "string"
          },
          "description": "Any significant events currently happening in the world"
        },
        "politicalClimate": {
          "type": "string",
          "description": "The current political situation, if relevant"
        },
        "activeEncounter": {
          "type": "string",
          "description": "Any ongoing non-combat encounter"
        },
        "activeCombatEncounter": {
          "type": "string",
          "description": "Any ongoing combat encounter"
        },
        "weatherConditions": {
          "type": "string",
          "description": "Specific details about the current weather"
        }
      },
      "required": ["year", "month", "day", "time", "weather", "season", "dayNightCycle", "moonPhase", "currentLocation", "currentArea", "currentAreaId", "majorEventsUnderway", "politicalClimate", "activeEncounter", "activeCombatEncounter", "weatherConditions"]
    },
    "activeQuests": {
      "type": "array",
      "items": {
        "type": "object",
        "properties": {
          "id": {
            "type": "string",
            "description": "Unique identifier for the quest (e.g., 'PP001' for main plot points, 'SQ001' for side quests)"
          },
          "title": {
            "type": "string",
            "description": "Brief title for the quest"
          },
          "description": {
            "type": "string",
            "description": "Detailed description of the quest"
          },
          "status": {
            "type": "string",
            "enum": ["not started", "in progress", "completed"],
            "description": "Current status of the quest"
          }
        },
        "required": ["id", "title", "description", "status"]
      },
      "description": "DEPRECATED: This field is no longer used. Quest data should be read directly from module_plot.json which is the single source of truth for all quest information. This field is preserved for backward compatibility only.",
      "deprecated": true
    }
  },
  "required": ["module", "partyMembers", "partyNPCs", "worldConditions"]
}