{
  "module": "Murder at the Drowning Lass",
  "partyMembers": [],
  "partyNPCs": [],
  "worldConditions": {
    "year": 1492,
    "month": "Firstmonth",
    "day": 1,
    "time": "08:00:00",
    "weather": "Clear",
    "season": "Winter",
    "dayNightCycle": "Day",
    "moonPhase": "New Moon",
    "currentLocation": "Gallowswatch Garrison",
    "currentLocationId": "H01",
    "currentArea": "The Brindlehearth Vale",
    "currentAreaId": "BV001",
    "majorEventsUnderway": [],
    "politicalClimate": "",
    "activeEncounter": "",
    "activeCombatEncounter": "",
    "weatherConditions": "",
    "lastCompletedEncounter": ""
  },
  "activeQuests": []
}
